#,CVE ID,CWE ID,# of Exploits,Vulnerability Type(s),Publish Date,Update Date,Score,Gained Access Level,Access,Complexity,Authentication,Conf.,Integ.,Avail.,Description
1,CVE-2018-12895,22,None,Exec Code Dir. Trav.,6/26/18,8/20/18,6.5,None,Remote,Low,Single system,Partial,Partial,Partial,"WordPress through 4.9.6 allows Author users to execute arbitrary code by leveraging directory traversal in the wp-admin/post.php thumb parameter, which is passed to the PHP unlink function and can delete the wp-config.php file. This is related to missing filename validation in the wp-includes/post.php wp_delete_attachment function. The attacker must have capabilities for files and posts that are normally available only to the Author, Editor, and Administrator roles. The attack methodology is to delete wp-config.php and then launch a new installation process to increase the attacker's privileges."
2,CVE-2018-10102,79,None,XSS,4/16/18,5/18/18,4.3,None,Remote,Medium,Not required,None,Partial,None,"Before WordPress 4.9.5, the version string was not escaped in the get_the_generator function, and could lead to XSS in a generator tag."
3,CVE-2018-10101,601,None,None,4/16/18,6/2/18,5.8,None,Remote,Medium,Not required,Partial,Partial,None,"Before WordPress 4.9.5, the URL validator assumed URLs with the hostname localhost were on the same host as the WordPress server."
4,CVE-2018-10100,601,None,None,4/16/18,5/18/18,5.8,None,Remote,Medium,Not required,Partial,Partial,None,"Before WordPress 4.9.5, the redirection URL for the login page was not validated or sanitized if forced to use HTTPS."
5,CVE-2018-6389,399,None,DoS,2/6/18,3/5/18,5,None,Remote,Low,Not required,None,None,Partial,"In WordPress through 4.9.2, unauthenticated attackers can cause a denial of service (resource consumption) by using the large list of registered .js files (from wp-includes/script-loader.php) to construct a series of requests to load every file many times."
6,CVE-2018-5776,79,None,XSS,1/18/18,2/1/18,4.3,None,Remote,Medium,Not required,None,Partial,None,WordPress before 4.9.2 has XSS in the Flash fallback files in MediaElement (under wp-includes/js/mediaelement).
7,CVE-2017-1001000,264,None,None,4/2/17,7/24/17,5,None,Remote,Low,Not required,None,Partial,None,"The register_routes function in wp-includes/rest-api/endpoints/class-wp-rest-posts-controller.php in the REST API in WordPress 4.7.x before 4.7.2 does not require an integer identifier, which allows remote attackers to modify arbitrary pages via a request for wp-json/wp/v2/posts followed by a numeric value and a non-numeric value, as demonstrated by the wp-json/wp/v2/posts/123?id=123helloworld URI."
8,CVE-2017-17094,79,None,XSS,12/2/17,2/3/18,3.5,None,Remote,Medium,Single system,None,Partial,None,"wp-includes/feed.php in WordPress before 4.9.1 does not properly restrict enclosures in RSS and Atom fields, which might allow attackers to conduct XSS attacks via a crafted URL."
9,CVE-2017-17093,79,None,XSS,12/2/17,2/3/18,3.5,None,Remote,Medium,Single system,None,Partial,None,"wp-includes/general-template.php in WordPress before 4.9.1 does not properly restrict the lang attribute of an HTML element, which might allow attackers to conduct XSS attacks via the language setting of a site."
10,CVE-2017-17092,79,None,XSS,12/2/17,2/3/18,3.5,None,Remote,Medium,Single system,None,Partial,None,"wp-includes/functions.php in WordPress before 4.9.1 does not require the unfiltered_html capability for upload of .js files, which might allow remote attackers to conduct XSS attacks via a crafted file."
11,CVE-2017-17091,284,None,Bypass,12/2/17,2/3/18,6.5,None,Remote,Low,Single system,Partial,Partial,Partial,"wp-admin/user-new.php in WordPress before 4.9.1 sets the newbloguser key to a string that can be directly derived from the user ID, which allows remote attackers to bypass intended access restrictions by entering this string."
12,CVE-2017-16510,89,None,Sql,11/2/17,2/3/18,7.5,None,Remote,Low,Not required,Partial,Partial,Partial,"WordPress before 4.8.3 is affected by an issue where $wpdb->prepare() can create unexpected and unsafe queries leading to potential SQL injection (SQLi) in plugins and themes, as demonstrated by a ""double prepare"" approach, a different vulnerability than CVE-2017-14723."
13,CVE-2017-14990,200,None,Sql +Info,10/2/17,11/9/17,4,None,Remote,Low,Single system,Partial,None,None,"WordPress 4.8.2 stores cleartext wp_signups.activation_key values (but stores the analogous wp_users.user_activation_key values as hashes), which might make it easier for remote attackers to hijack unactivated user accounts by leveraging database read access (such as access gained through an unspecified SQL injection vulnerability)."
14,CVE-2017-14726,79,None,XSS,9/23/17,11/9/17,4.3,None,Remote,Medium,Not required,None,Partial,None,"Before version 4.8.2, WordPress was vulnerable to a cross-site scripting attack via shortcodes in the TinyMCE visual editor."
15,CVE-2017-14725,601,None,None,9/23/17,11/9/17,4.9,None,Remote,Medium,Single system,Partial,Partial,None,"Before version 4.8.2, WordPress was susceptible to an open redirect attack in wp-admin/edit-tag-form.php and wp-admin/user-edit.php."
16,CVE-2017-14724,79,None,XSS,9/23/17,11/9/17,4.3,None,Remote,Medium,Not required,None,Partial,None,"Before version 4.8.2, WordPress was vulnerable to cross-site scripting in oEmbed discovery."
17,CVE-2017-14723,89,None,Sql,9/23/17,11/9/17,7.5,None,Remote,Low,Not required,Partial,Partial,Partial,"Before version 4.8.2, WordPress mishandled % characters and additional placeholder values in $wpdb->prepare, and thus did not properly address the possibility of plugins and themes enabling SQL injection attacks."
18,CVE-2017-14722,22,None,Dir. Trav.,9/23/17,11/9/17,5,None,Remote,Low,Not required,Partial,None,None,"Before version 4.8.2, WordPress allowed a Directory Traversal attack in the Customizer component via a crafted theme filename."
19,CVE-2017-14721,79,None,XSS,9/23/17,11/9/17,4.3,None,Remote,Medium,Not required,None,Partial,None,"Before version 4.8.2, WordPress allowed Cross-Site scripting in the plugin editor via a crafted plugin name."
20,CVE-2017-14720,79,None,XSS,9/23/17,11/9/17,4.3,None,Remote,Medium,Not required,None,Partial,None,"Before version 4.8.2, WordPress allowed a Cross-Site scripting attack in the template list view via a crafted template name."
21,CVE-2017-14719,22,None,Dir. Trav.,9/23/17,11/9/17,5,None,Remote,Low,Not required,Partial,None,None,"Before version 4.8.2, WordPress was vulnerable to a directory traversal attack during unzip operations in the ZipArchive and PclZip components."
22,CVE-2017-14718,79,None,XSS,9/23/17,11/9/17,4.3,None,Remote,Medium,Not required,None,Partial,None,"Before version 4.8.2, WordPress was susceptible to a Cross-Site Scripting attack in the link modal via a javascript: or data: URL."
23,CVE-2017-9066,918,None,None,5/18/17,1/18/18,5,None,Remote,Low,Not required,None,Partial,None,"In WordPress before 4.7.5, there is insufficient redirect validation in the HTTP class, leading to SSRF."
24,CVE-2017-9065,20,None,None,5/18/17,11/3/17,5,None,Remote,Low,Not required,None,Partial,None,"In WordPress before 4.7.5, there is a lack of capability checks for post meta data in the XML-RPC API."
25,CVE-2017-9064,352,None,CSRF,5/18/17,11/3/17,6.8,None,Remote,Medium,Not required,Partial,Partial,Partial,"In WordPress before 4.7.5, a Cross Site Request Forgery (CSRF) vulnerability exists in the filesystem credentials dialog because a nonce is not required for updating credentials."
26,CVE-2017-9063,79,None,XSS,5/18/17,11/3/17,4.3,None,Remote,Medium,Not required,None,Partial,None,"In WordPress before 4.7.5, a cross-site scripting (XSS) vulnerability related to the Customizer exists, involving an invalid customization session."
27,CVE-2017-9062,19,None,None,5/18/17,11/3/17,5,None,Remote,Low,Not required,None,Partial,None,"In WordPress before 4.7.5, there is improper handling of post meta data values in the XML-RPC API."
28,CVE-2017-9061,79,None,XSS,5/18/17,11/3/17,4.3,None,Remote,Medium,Not required,None,Partial,None,"In WordPress before 4.7.5, a cross-site scripting (XSS) vulnerability exists when attempting to upload very large files, because the error message does not properly restrict presentation of the filename."
29,CVE-2017-8295,640,None,None,5/4/17,11/3/17,4.3,None,Remote,Medium,Not required,None,Partial,None,"WordPress through 4.7.4 relies on the Host HTTP header for a password-reset e-mail message, which makes it easier for remote attackers to reset arbitrary passwords by making a crafted wp-login.php?action=lostpassword request and then arranging for this message to bounce or be resent, leading to transmission of the reset key to a mailbox on an attacker-controlled SMTP server. This is related to problematic use of the SERVER_NAME variable in wp-includes/pluggable.php in conjunction with the PHP mail function. Exploitation is not achievable in all cases because it requires at least one of the following: (1) the attacker can prevent the victim from receiving any e-mail messages for an extended period of time (such as 5 days), (2) the victim's e-mail system sends an autoresponse containing the original message, or (3) the victim manually composes a reply containing the original message."
30,CVE-2017-6819,352,None,CSRF,3/11/17,7/17/17,4.3,None,Remote,Medium,Not required,None,None,Partial,"In WordPress before 4.7.3, there is cross-site request forgery (CSRF) in Press This (wp-admin/includes/class-wp-press-this.php), leading to excessive use of server resources. The CSRF can trigger an outbound HTTP request for a large file that is then parsed by Press This."
31,CVE-2017-6818,79,None,XSS,3/11/17,7/17/17,4.3,None,Remote,Medium,Not required,None,Partial,None,"In WordPress before 4.7.3 (wp-admin/js/tags-box.js), there is cross-site scripting (XSS) via taxonomy term names."
32,CVE-2017-6817,79,None,XSS,3/11/17,11/3/17,3.5,None,Remote,Medium,Single system,None,Partial,None,"In WordPress before 4.7.3 (wp-includes/embed.php), there is authenticated Cross-Site Scripting (XSS) in YouTube URL Embeds."
33,CVE-2017-6816,284,None,None,3/11/17,11/3/17,4,None,Remote,Low,Single system,None,Partial,None,"In WordPress before 4.7.3 (wp-admin/plugins.php), unintended files can be deleted by administrators using the plugin deletion functionality."
34,CVE-2017-6815,20,None,None,3/11/17,11/3/17,5.8,None,Remote,Medium,Not required,Partial,Partial,None,"In WordPress before 4.7.3 (wp-includes/pluggable.php), control characters can trick redirect URL validation."
35,CVE-2017-6814,79,None,XSS,3/11/17,11/3/17,3.5,None,Remote,Medium,Single system,None,Partial,None,"In WordPress before 4.7.3, there is authenticated Cross-Site Scripting (XSS) via Media File Metadata. This is demonstrated by both (1) mishandling of the playlist shortcode in the wp_playlist_shortcode function in wp-includes/media.php and (2) mishandling of meta information in the renderTracks function in wp-includes/js/mediaelement/wp-playlist.js."
36,CVE-2017-5612,79,None,XSS,1/29/17,11/3/17,4.3,None,Remote,Medium,Not required,None,Partial,None,Cross-site scripting (XSS) vulnerability in wp-admin/includes/class-wp-posts-list-table.php in the posts list table in WordPress before 4.7.2 allows remote attackers to inject arbitrary web script or HTML via a crafted excerpt.
37,CVE-2017-5611,89,None,Exec Code Sql,1/29/17,11/3/17,7.5,None,Remote,Low,Not required,Partial,Partial,Partial,SQL injection vulnerability in wp-includes/class-wp-query.php in WP_Query in WordPress before 4.7.2 allows remote attackers to execute arbitrary SQL commands by leveraging the presence of an affected plugin or theme that mishandles a crafted post type name.
38,CVE-2017-5610,200,None,Bypass +Info,1/29/17,11/3/17,5,None,Remote,Low,Not required,Partial,None,None,"wp-admin/includes/class-wp-press-this.php in Press This in WordPress before 4.7.2 does not properly restrict visibility of a taxonomy-assignment user interface, which allows remote attackers to bypass intended access restrictions by reading terms."
39,CVE-2017-5493,310,None,Bypass,1/14/17,11/3/17,5,None,Remote,Low,Not required,None,Partial,None,"wp-includes/ms-functions.php in the Multisite WordPress API in WordPress before 4.7.1 does not properly choose random numbers for keys, which makes it easier for remote attackers to bypass intended access restrictions via a crafted (1) site signup or (2) user signup."
40,CVE-2017-5492,352,None,CSRF,1/14/17,11/3/17,6.8,None,Remote,Medium,Not required,Partial,Partial,Partial,"Cross-site request forgery (CSRF) vulnerability in the widget-editing accessibility-mode feature in WordPress before 4.7.1 allows remote attackers to hijack the authentication of unspecified victims for requests that perform a widgets-access action, related to wp-admin/includes/class-wp-screen.php and wp-admin/widgets.php."
41,CVE-2017-5491,254,None,Bypass,1/14/17,11/3/17,5,None,Remote,Low,Not required,None,Partial,None,wp-mail.php in WordPress before 4.7.1 might allow remote attackers to bypass intended posting restrictions via a spoofed mail server with the mail.example.com name.
42,CVE-2017-5490,79,None,XSS,1/14/17,11/3/17,4.3,None,Remote,Medium,Not required,None,Partial,None,"Cross-site scripting (XSS) vulnerability in the theme-name fallback functionality in wp-includes/class-wp-theme.php in WordPress before 4.7.1 allows remote attackers to inject arbitrary web script or HTML via a crafted directory name of a theme, related to wp-admin/includes/class-theme-installer-skin.php."
43,CVE-2017-5489,352,None,CSRF,1/14/17,11/3/17,6.8,None,Remote,Medium,Not required,Partial,Partial,Partial,Cross-site request forgery (CSRF) vulnerability in WordPress before 4.7.1 allows remote attackers to hijack the authentication of unspecified victims via vectors involving a Flash file upload.
44,CVE-2017-5488,79,None,XSS,1/14/17,11/3/17,4.3,None,Remote,Medium,Not required,None,Partial,None,Multiple cross-site scripting (XSS) vulnerabilities in wp-admin/update-core.php in WordPress before 4.7.1 allow remote attackers to inject arbitrary web script or HTML via the (1) name or (2) version header of a plugin.
45,CVE-2017-5487,200,None,#NAME?,1/14/17,8/31/17,5,None,Remote,Low,Not required,Partial,None,None,"wp-includes/rest-api/endpoints/class-wp-rest-users-controller.php in the REST API implementation in WordPress 4.7 before 4.7.1 does not properly restrict listings of post authors, which allows remote attackers to obtain sensitive information via a wp-json/wp/v2/users request."
46,CVE-2016-10148,284,None,Bypass,1/18/17,3/15/17,4,None,Remote,Low,Single system,Partial,None,None,"The wp_ajax_update_plugin function in wp-admin/includes/ajax-actions.php in WordPress before 4.6 makes a get_plugin_data call before checking the update_plugins capability, which allows remote authenticated users to bypass intended read-access restrictions via the plugin parameter to wp-admin/admin-ajax.php, a related issue to CVE-2016-6896."
47,CVE-2016-9263,20,None,None,10/12/17,10/26/17,2.6,None,Remote,High,Not required,None,Partial,None,"WordPress through 4.8.2, when domain-based flashmediaelement.swf sandboxing is not used, allows remote attackers to conduct cross-domain Flash injection (XSF) attacks by leveraging code contained within the wp-includes/js/mediaelement/flashmediaelement.swf file."
48,CVE-2016-7169,22,None,Dir. Trav.,1/4/17,11/3/17,6.5,None,Remote,Low,Single system,Partial,Partial,Partial,Directory traversal vulnerability in the File_Upload_Upgrader class in wp-admin/includes/class-file-upload-upgrader.php in the upgrade package uploader in WordPress before 4.6.1 allows remote authenticated users to access arbitrary files via a crafted urlholder parameter.
49,CVE-2016-7168,79,None,XSS,1/4/17,11/3/17,3.5,None,Remote,Medium,Single system,None,Partial,None,Cross-site scripting (XSS) vulnerability in the media_handle_upload function in wp-admin/includes/media.php in WordPress before 4.6.1 might allow remote attackers to inject arbitrary web script or HTML by tricking an administrator into uploading an image file that has a crafted filename.
50,CVE-2016-6897,352,None,CSRF,1/18/17,9/2/17,4.3,None,Remote,Medium,Not required,Partial,None,None,"Cross-site request forgery (CSRF) vulnerability in the wp_ajax_update_plugin function in wp-admin/includes/ajax-actions.php in WordPress before 4.6 allows remote attackers to hijack the authentication of subscribers for /dev/random read operations by leveraging a late call to the check_ajax_referer function, a related issue to CVE-2016-6896."
51,CVE-2016-6896,22,None,DoS Dir. Trav.,1/18/17,9/2/17,5.5,None,Remote,Low,Single system,Partial,None,Partial,"Directory traversal vulnerability in the wp_ajax_update_plugin function in wp-admin/includes/ajax-actions.php in WordPress 4.5.3 allows remote authenticated users to cause a denial of service or read certain text files via a .. (dot dot) in the plugin parameter to wp-admin/admin-ajax.php, as demonstrated by /dev/random read operations that deplete the entropy pool."
52,CVE-2016-6635,352,None,CSRF,8/7/16,11/3/17,6.8,None,Remote,Medium,Not required,Partial,Partial,Partial,Cross-site request forgery (CSRF) vulnerability in the wp_ajax_wp_compression_test function in wp-admin/includes/ajax-actions.php in WordPress before 4.5 allows remote attackers to hijack the authentication of administrators for requests that change the script compression option.
53,CVE-2016-6634,79,None,XSS,8/7/16,11/3/17,4.3,None,Remote,Medium,Not required,None,Partial,None,Cross-site scripting (XSS) vulnerability in the network settings page in WordPress before 4.5 allows remote attackers to inject arbitrary web script or HTML via unspecified vectors.
54,CVE-2016-5839,None,None,Bypass,6/29/16,11/28/16,5,None,Remote,Low,Not required,None,Partial,None,WordPress before 4.5.3 allows remote attackers to bypass the sanitize_file_name protection mechanism via unspecified vectors.
55,CVE-2016-5838,255,None,Bypass,6/29/16,11/29/16,5,None,Remote,Low,Not required,None,Partial,None,WordPress before 4.5.3 allows remote attackers to bypass intended password-change restrictions by leveraging knowledge of a cookie.
56,CVE-2016-5837,None,None,Bypass,6/29/16,11/29/16,5,None,Remote,Low,Not required,None,Partial,None,WordPress before 4.5.3 allows remote attackers to bypass intended access restrictions and remove a category attribute from a post via unspecified vectors.
57,CVE-2016-5836,None,None,DoS,6/29/16,7/30/18,5,None,Remote,Low,Not required,None,None,Partial,The oEmbed protocol implementation in WordPress before 4.5.3 allows remote attackers to cause a denial of service via unspecified vectors.
58,CVE-2016-5835,200,None,#NAME?,6/29/16,11/29/16,5,None,Remote,Low,Not required,Partial,None,None,"WordPress before 4.5.3 allows remote attackers to obtain sensitive revision-history information by leveraging the ability to read a post, related to wp-admin/includes/ajax-actions.php and wp-admin/revision.php."
59,CVE-2016-5834,79,None,XSS,6/29/16,11/29/16,4.3,None,Remote,Medium,Not required,None,Partial,None,"Cross-site scripting (XSS) vulnerability in the wp_get_attachment_link function in wp-includes/post-template.php in WordPress before 4.5.3 allows remote attackers to inject arbitrary web script or HTML via a crafted attachment name, a different vulnerability than CVE-2016-5833."
60,CVE-2016-5833,79,None,XSS,6/29/16,11/29/16,4.3,None,Remote,Medium,Not required,None,Partial,None,"Cross-site scripting (XSS) vulnerability in the column_title function in wp-admin/includes/class-wp-media-list-table.php in WordPress before 4.5.3 allows remote attackers to inject arbitrary web script or HTML via a crafted attachment name, a different vulnerability than CVE-2016-5834."
61,CVE-2016-5832,None,None,Bypass,6/29/16,11/29/16,5,None,Remote,Low,Not required,None,Partial,None,The customizer in WordPress before 4.5.3 allows remote attackers to bypass intended redirection restrictions via unspecified vectors.
62,CVE-2016-4567,79,None,XSS,5/21/16,12/2/16,4.3,None,Remote,Medium,Not required,None,Partial,None,"Cross-site scripting (XSS) vulnerability in flash/FlashMediaElement.as in MediaElement.js before 2.21.0, as used in WordPress before 4.5.2, allows remote attackers to inject arbitrary web script or HTML via an obfuscated form of the jsinitfunction parameter, as demonstrated by ""jsinitfunctio%gn."""
63,CVE-2016-4566,79,None,XSS,5/21/16,12/2/16,4.3,None,Remote,Medium,Not required,None,Partial,None,"Cross-site scripting (XSS) vulnerability in plupload.flash.swf in Plupload before 2.1.9, as used in WordPress before 4.5.2, allows remote attackers to inject arbitrary web script or HTML via a Same-Origin Method Execution (SOME) attack."
64,CVE-2016-4029,285,None,Bypass,8/7/16,11/3/17,5,None,Remote,Low,Not required,None,Partial,None,"WordPress before 4.5 does not consider octal and hexadecimal IP address formats when determining an intranet address, which allows remote attackers to bypass an intended SSRF protection mechanism via a crafted address."
65,CVE-2016-2222,None,None,None,5/21/16,11/3/17,5,None,Remote,Low,Not required,None,Partial,None,The wp_http_validate_url function in wp-includes/http.php in WordPress before 4.4.2 allows remote attackers to conduct server-side request forgery (SSRF) attacks via a zero value in the first octet of an IPv4 address in the u parameter to wp-admin/press-this.php.
66,CVE-2016-2221,None,None,None,5/21/16,11/3/17,5.8,None,Remote,Medium,Not required,Partial,Partial,None,"Open redirect vulnerability in the wp_validate_redirect function in wp-includes/pluggable.php in WordPress before 4.4.2 allows remote attackers to redirect users to arbitrary web sites and conduct phishing attacks via a malformed URL that triggers incorrect hostname parsing, as demonstrated by an https:example.com URL."
67,CVE-2016-1564,79,None,XSS,5/21/16,11/3/17,4.3,None,Remote,Medium,Not required,None,Partial,None,Multiple cross-site scripting (XSS) vulnerabilities in wp-includes/class-wp-theme.php in WordPress before 4.4.1 allow remote attackers to inject arbitrary web script or HTML via a (1) stylesheet name or (2) template name to wp-admin/customize.php.
68,CVE-2015-8834,79,None,XSS,5/21/16,11/28/16,4.3,None,Remote,Medium,Not required,None,Partial,None,Cross-site scripting (XSS) vulnerability in wp-includes/wp-db.php in WordPress before 4.2.2 allows remote attackers to inject arbitrary web script or HTML via a long comment that is improperly stored because of limitations on the MySQL TEXT data type.  NOTE: this vulnerability exists because of an incomplete fix for CVE-2015-3440.
69,CVE-2015-7989,79,None,XSS,5/21/16,11/3/17,3.5,None,Remote,Medium,Single system,None,Partial,None,"Cross-site scripting (XSS) vulnerability in the user list table in WordPress before 4.3.1 allows remote authenticated users to inject arbitrary web script or HTML via a crafted e-mail address, a different vulnerability than CVE-2015-5714."
70,CVE-2015-5734,79,None,XSS,11/9/15,11/3/17,4.3,None,Remote,Medium,Not required,None,Partial,None,Cross-site scripting (XSS) vulnerability in the legacy theme preview implementation in wp-includes/theme.php in WordPress before 4.2.4 allows remote attackers to inject arbitrary web script or HTML via a crafted string.
71,CVE-2015-5733,79,None,XSS,11/9/15,9/20/17,4.3,None,Remote,Medium,Not required,None,Partial,None,Cross-site scripting (XSS) vulnerability in the refreshAdvancedAccessibilityOfItem function in wp-admin/js/nav-menu.js in WordPress before 4.2.4 allows remote attackers to inject arbitrary web script or HTML via an accessibility-helper title.
72,CVE-2015-5732,79,None,XSS,11/9/15,11/3/17,4.3,None,Remote,Medium,Not required,None,Partial,None,Cross-site scripting (XSS) vulnerability in the form function in the WP_Nav_Menu_Widget class in wp-includes/default-widgets.php in WordPress before 4.2.4 allows remote attackers to inject arbitrary web script or HTML via a widget title.
73,CVE-2015-5731,352,None,DoS CSRF,11/9/15,11/3/17,6.8,None,Remote,Medium,Not required,Partial,Partial,Partial,"Cross-site request forgery (CSRF) vulnerability in wp-admin/post.php in WordPress before 4.2.4 allows remote attackers to hijack the authentication of administrators for requests that lock a post, and consequently cause a denial of service (editing blockage), via a get-post-lock action."
74,CVE-2015-5730,200,None,#NAME?,11/9/15,9/20/17,5,None,Remote,Low,Not required,Partial,None,None,"The sanitize_widget_instance function in wp-includes/class-wp-customize-widgets.php in WordPress before 4.2.4 does not use a constant-time comparison for widgets, which allows remote attackers to conduct a timing side-channel attack by measuring the delay before inequality is calculated."
75,CVE-2015-5715,264,None,Bypass,5/21/16,11/3/17,4,None,Remote,Low,Single system,None,Partial,None,"The mw_editPost function in wp-includes/class-wp-xmlrpc-server.php in the XMLRPC subsystem in WordPress before 4.3.1 allows remote authenticated users to bypass intended access restrictions, and arrange for a private post to be published and sticky, via unspecified vectors."
76,CVE-2015-5714,79,None,XSS,5/21/16,11/3/17,4.3,None,Remote,Medium,Not required,None,Partial,None,Cross-site scripting (XSS) vulnerability in WordPress before 4.3.1 allows remote attackers to inject arbitrary web script or HTML by leveraging the mishandling of unclosed HTML elements during processing of shortcode tags.
77,CVE-2015-5623,284,None,Bypass,8/3/15,9/20/17,4,None,Remote,Low,Single system,None,Partial,None,"WordPress before 4.2.3 does not properly verify the edit_posts capability, which allows remote authenticated users to bypass intended access restrictions and create drafts by leveraging the Subscriber role, as demonstrated by a post-quickdraft-save action to wp-admin/post.php."
