#,CVE ID,CWE ID,# of Exploits,Vulnerability Type(s),Publish Date,Update Date,Score,Gained Access Level,Access,Complexity,Authentication,Conf.,Integ.,Avail.,Description
1,CVE-2018-8014,254,None,None,5/16/18,8/17/18,7.5,None,Remote,Low,Not required,Partial,Partial,Partial,"The defaults settings for the CORS filter provided in Apache Tomcat 9.0.0.M1 to 9.0.8, 8.5.0 to 8.5.31, 8.0.0.RC1 to 8.0.52, 7.0.41 to 7.0.88 are insecure and enable 'supportsCredentials' for all origins. It is expected that users of the CORS filter will have configured it appropriately for their environment rather than using it in the default configuration. Therefore, it is expected that most users will not be impacted by this issue."
2,CVE-2018-1305,284,None,None,2/23/18,8/29/18,4,None,Remote,Low,Single system,Partial,None,None,"Security constraints defined by annotations of Servlets in Apache Tomcat 9.0.0.M1 to 9.0.4, 8.5.0 to 8.5.27, 8.0.0.RC1 to 8.0.49 and 7.0.0 to 7.0.84 were only applied once a Servlet had been loaded. Because security constraints defined in this way apply to the URL pattern and any URLs below that point, it was possible - depending on the order Servlets were loaded - for some security constraints not to be applied. This could have exposed resources to users who were not authorised to access them."
3,CVE-2018-1304,254,None,None,2/28/18,8/29/18,4.3,None,Remote,Medium,Not required,Partial,None,None,"The URL pattern of """" (the empty string) which exactly maps to the context root was not correctly handled in Apache Tomcat 9.0.0.M1 to 9.0.4, 8.5.0 to 8.5.27, 8.0.0.RC1 to 8.0.49 and 7.0.0 to 7.0.84 when used as part of a security constraint definition. This caused the constraint to be ignored. It was, therefore, possible for unauthorised users to gain access to web application resources that should have been protected. Only security constraints with a URL pattern of the empty string were affected."
4,CVE-2017-15706,358,None,None,1/31/18,5/31/18,5,None,Remote,Low,Not required,None,Partial,None,"As part of the fix for bug 61201, the documentation for Apache Tomcat 9.0.0.M22 to 9.0.1, 8.5.16 to 8.5.23, 8.0.45 to 8.0.47 and 7.0.79 to 7.0.82 included an updated description of the search algorithm used by the CGI Servlet to identify which script to execute. The update was not correct. As a result, some scripts may have failed to execute as expected and other scripts may have been executed unexpectedly. Note that the behaviour of the CGI servlet has remained unchanged in this regard. It is only the documentation of the behaviour that was wrong and has been corrected."
5,CVE-2017-12617,434,None,Exec Code,10/3/17,7/18/18,6.8,None,Remote,Medium,Not required,Partial,Partial,Partial,"When running Apache Tomcat versions 9.0.0.M1 to 9.0.0, 8.5.0 to 8.5.22, 8.0.0.RC1 to 8.0.46 and 7.0.0 to 7.0.81 with HTTP PUTs enabled (e.g. via setting the readonly initialisation parameter of the Default servlet to false) it was possible to upload a JSP file to the server via a specially crafted request. This JSP could then be requested and any code it contained would be executed by the server."
6,CVE-2017-12616,200,None,Bypass +Info,9/19/17,6/28/18,5,None,Remote,Low,Not required,Partial,None,None,When using a VirtualDirContext with Apache Tomcat 7.0.0 to 7.0.80 it was possible to bypass security constraints and/or view the source code of JSPs for resources served by the VirtualDirContext using a specially crafted request.
7,CVE-2017-12615,434,None,Exec Code,9/19/17,3/8/18,6.8,None,Remote,Medium,Not required,Partial,Partial,Partial,When running Apache Tomcat 7.0.0 to 7.0.79 on Windows with HTTP PUTs enabled (e.g. via setting the readonly initialisation parameter of the Default to false) it was possible to upload a JSP file to the server via a specially crafted request. This JSP could then be requested and any code it contained would be executed by the server.
8,CVE-2017-7675,22,None,Dir. Trav. Bypass,8/10/17,6/15/18,5,None,Remote,Low,Not required,Partial,None,None,The HTTP/2 implementation in Apache Tomcat 9.0.0.M1 to 9.0.0.M21 and 8.5.0 to 8.5.15 bypassed a number of security checks that prevented directory traversal attacks. It was therefore possible to bypass security constraints using a specially crafted URL.
9,CVE-2017-7674,345,None,None,8/10/17,6/28/18,4.3,None,Remote,Medium,Not required,None,Partial,None,"The CORS Filter in Apache Tomcat 9.0.0.M1 to 9.0.0.M21, 8.5.0 to 8.5.15, 8.0.0.RC1 to 8.0.44 and 7.0.41 to 7.0.78 did not add an HTTP Vary header indicating that the response varies depending on Origin. This permitted client and server side cache poisoning in some circumstances."
10,CVE-2017-6056,19,None,DoS,2/17/17,8/1/18,5,None,Remote,Low,Not required,None,None,Partial,It was discovered that a programming error in the processing of HTTPS requests in the Apache Tomcat servlet and JSP engine may result in denial of service via an infinite loop. The denial of service is easily achievable as a consequence of backporting a CVE-2016-6816 fix but not backporting the fix for Tomcat bug 57544. Distributions affected by this backporting issue include Debian (before 7.0.56-3+deb8u8 and 8.0.14-1+deb8u7 in jessie) and Ubuntu.
11,CVE-2017-5664,254,None,None,6/6/17,7/18/18,5,None,Remote,Low,Not required,None,Partial,None,"The error page mechanism of the Java Servlet Specification requires that, when an error occurs and an error page is configured for the error that occurred, the original request and response are forwarded to the error page. This means that the request is presented to the error page with the original HTTP method. If the error page is a static file, expected behaviour is to serve content of the file as if processing a GET request, regardless of the actual HTTP method. The Default Servlet in Apache Tomcat 9.0.0.M1 to 9.0.0.M20, 8.5.0 to 8.5.14, 8.0.0.RC1 to 8.0.43 and 7.0.0 to 7.0.77 did not do this. Depending on the original request this could lead to unexpected and undesirable results for static error pages including, if the DefaultServlet is configured to permit writes, the replacement or removal of the custom error page. Notes for other user provided error pages: (1) Unless explicitly coded otherwise, JSPs ignore the HTTP method. JSPs used as error pages must must ensure that they handle any error dispatch as a GET request, regardless of the actual method. (2) By default, the response generated by a Servlet does depend on the HTTP method. Custom Servlets used as error pages must ensure that they handle any error dispatch as a GET request, regardless of the actual method."
12,CVE-2017-5651,19,None,None,4/17/17,6/15/18,7.5,None,Remote,Low,Not required,Partial,Partial,Partial,"In Apache Tomcat 9.0.0.M1 to 9.0.0.M18 and 8.5.0 to 8.5.12, the refactoring of the HTTP connectors introduced a regression in the send file processing. If the send file processing completed quickly, it was possible for the Processor to be added to the processor cache twice. This could result in the same Processor being used for multiple requests which in turn could lead to unexpected errors and/or response mix-up."
13,CVE-2017-5650,399,None,None,4/17/17,6/15/18,5,None,Remote,Low,Not required,None,None,Partial,"In Apache Tomcat 9.0.0.M1 to 9.0.0.M18 and 8.5.0 to 8.5.12, the handling of an HTTP/2 GOAWAY frame for a connection did not close streams associated with that connection that were currently waiting for a WINDOW_UPDATE before allowing the application to write more data. These waiting streams each consumed a thread. A malicious client could therefore construct a series of HTTP/2 requests that would consume all available processing threads."
14,CVE-2017-5648,284,None,None,4/17/17,6/15/18,6.4,None,Remote,Low,Not required,Partial,Partial,None,"While investigating bug 60718, it was noticed that some calls to application listeners in Apache Tomcat 9.0.0.M1 to 9.0.0.M17, 8.5.0 to 8.5.11, 8.0.0.RC1 to 8.0.41, and 7.0.0 to 7.0.75 did not use the appropriate facade object. When running an untrusted application under a SecurityManager, it was therefore possible for that untrusted application to retain a reference to the request or response object and thereby access and/or modify information associated with another web application."
15,CVE-2017-5647,200,None,#NAME?,4/17/17,6/15/18,5,None,Remote,Low,Not required,Partial,None,None,"A bug in the handling of the pipelined requests in Apache Tomcat 9.0.0.M1 to 9.0.0.M18, 8.5.0 to 8.5.12, 8.0.0.RC1 to 8.0.42, 7.0.0 to 7.0.76, and 6.0.0 to 6.0.52, when send file was used, results in the pipelined request being lost when send file processing of the previous request completed. This could result in responses appearing to be sent for the wrong request. For example, a user agent that sent requests A, B and C could see the correct response for request A, the response for request C for request B and no response for request C."
16,CVE-2016-9775,264,None,#NAME?,3/23/17,8/1/18,7.2,None,Local,Low,Not required,Complete,Complete,Complete,"The postrm script in the tomcat6 package before 6.0.45+dfsg-1~deb7u3 on Debian wheezy, before 6.0.45+dfsg-1~deb8u1 on Debian jessie, before 6.0.35-1ubuntu3.9 on Ubuntu 12.04 LTS and on Ubuntu 14.04 LTS; the tomcat7 package before 7.0.28-4+deb7u7 on Debian wheezy, before 7.0.56-3+deb8u6 on Debian jessie, before 7.0.52-1ubuntu0.8 on Ubuntu 14.04 LTS, and on Ubuntu 12.04 LTS, 16.04 LTS, and 16.10; and the tomcat8 package before 8.0.14-1+deb8u5 on Debian jessie, before 8.0.32-1ubuntu1.3 on Ubuntu 16.04 LTS, before 8.0.37-1ubuntu0.1 on Ubuntu 16.10, and before 8.0.38-2ubuntu1 on Ubuntu 17.04 might allow local users with access to the tomcat account to gain root privileges via a setgid program in the Catalina directory, as demonstrated by /etc/tomcat8/Catalina/attack."
17,CVE-2016-9774,59,None,#NAME?,3/23/17,8/1/18,7.2,None,Local,Low,Not required,Complete,Complete,Complete,"The postinst script in the tomcat6 package before 6.0.45+dfsg-1~deb7u4 on Debian wheezy, before 6.0.35-1ubuntu3.9 on Ubuntu 12.04 LTS and on Ubuntu 14.04 LTS; the tomcat7 package before 7.0.28-4+deb7u8 on Debian wheezy, before 7.0.56-3+deb8u6 on Debian jessie, before 7.0.52-1ubuntu0.8 on Ubuntu 14.04 LTS, and on Ubuntu 12.04 LTS, 16.04 LTS, and 16.10; and the tomcat8 package before 8.0.14-1+deb8u5 on Debian jessie, before 8.0.32-1ubuntu1.3 on Ubuntu 16.04 LTS, before 8.0.37-1ubuntu0.1 on Ubuntu 16.10, and before 8.0.38-2ubuntu1 on Ubuntu 17.04 might allow local users with access to the tomcat account to obtain sensitive information or gain root privileges via a symlink attack on the Catalina localhost directory."
18,CVE-2016-8747,200,None,#NAME?,3/14/17,6/15/18,5,None,Remote,Low,Not required,Partial,None,None,An information disclosure issue was discovered in Apache Tomcat 8.5.7 to 8.5.9 and 9.0.0.M11 to 9.0.0.M15 in reverse-proxy configurations. Http11InputBuffer.java allows remote attackers to read data that was intended to be associated with a different request.
19,CVE-2016-8745,388,None,#NAME?,8/10/17,6/8/18,5,None,Remote,Low,Not required,Partial,None,None,"A bug in the error handling of the send file code for the NIO HTTP connector in Apache Tomcat 9.0.0.M1 to 9.0.0.M13, 8.5.0 to 8.5.8, 8.0.0.RC1 to 8.0.39, 7.0.0 to 7.0.73 and 6.0.16 to 6.0.48 resulted in the current Processor object being added to the Processor cache multiple times. This in turn meant that the same Processor could be used for concurrent requests. Sharing a Processor can result in information leakage between requests including, not not limited to, session ID and the response body. The bug was first noticed in 8.5.x onwards where it appears the refactoring of the Connector code for 8.5.x onwards made it more likely that the bug was observed. Initially it was thought that the 8.5.x refactoring introduced the bug but further investigation has shown that the bug is present in all currently supported Tomcat versions."
20,CVE-2016-8735,284,None,Exec Code,4/6/17,7/18/18,7.5,None,Remote,Low,Not required,Partial,Partial,Partial,"Remote code execution is possible with Apache Tomcat before 6.0.48, 7.x before 7.0.73, 8.x before 8.0.39, 8.5.x before 8.5.7, and 9.x before 9.0.0.M12 if JmxRemoteLifecycleListener is used and an attacker can reach JMX ports. The issue exists because this listener wasn't updated for consistency with the CVE-2016-3427 Oracle patch that affected credential types."
21,CVE-2016-6817,119,None,DoS Overflow,8/10/17,6/8/18,5,None,Remote,Low,Not required,None,None,Partial,The HTTP/2 header parser in Apache Tomcat 9.0.0.M1 to 9.0.0.M11 and 8.5.0 to 8.5.6 entered an infinite loop if a header was received that was larger than the available buffer. This made a denial of service attack possible.
22,CVE-2016-6816,20,None,XSS +Info,3/20/17,6/8/18,6.8,None,Remote,Medium,Not required,Partial,Partial,Partial,"The code in Apache Tomcat 9.0.0.M1 to 9.0.0.M11, 8.5.0 to 8.5.6, 8.0.0.RC1 to 8.0.38, 7.0.0 to 7.0.72, and 6.0.0 to 6.0.47 that parsed the HTTP request line permitted invalid characters. This could be exploited, in conjunction with a proxy that also permitted the invalid characters but with a different interpretation, to inject data into the HTTP response. By manipulating the HTTP response the attacker could poison a web-cache, perform an XSS attack and/or obtain sensitive information from requests other then their own."
23,CVE-2016-6797,284,None,None,8/10/17,6/5/18,5,None,Remote,Low,Not required,Partial,None,None,"The ResourceLinkFactory implementation in Apache Tomcat 9.0.0.M1 to 9.0.0.M9, 8.5.0 to 8.5.4, 8.0.0.RC1 to 8.0.36, 7.0.0 to 7.0.70 and 6.0.0 to 6.0.45 did not limit web application access to global JNDI resources to those resources explicitly linked to the web application. Therefore, it was possible for a web application to access any global JNDI resource whether an explicit ResourceLink had been configured or not."
24,CVE-2016-6796,254,None,Bypass,8/10/17,6/5/18,5,None,Remote,Low,Not required,None,Partial,None,"A malicious web application running on Apache Tomcat 9.0.0.M1 to 9.0.0.M9, 8.5.0 to 8.5.4, 8.0.0.RC1 to 8.0.36, 7.0.0 to 7.0.70 and 6.0.0 to 6.0.45 was able to bypass a configured SecurityManager via manipulation of the configuration parameters for the JSP Servlet."
25,CVE-2016-6794,200,None,Bypass +Info,8/10/17,6/5/18,5,None,Remote,Low,Not required,Partial,None,None,"When a SecurityManager is configured, a web application's ability to read system properties should be controlled by the SecurityManager. In Apache Tomcat 9.0.0.M1 to 9.0.0.M9, 8.5.0 to 8.5.4, 8.0.0.RC1 to 8.0.36, 7.0.0 to 7.0.70, 6.0.0 to 6.0.45 the system property replacement feature for configuration files could be used by a malicious web application to bypass the SecurityManager and read system properties that should not be visible."
26,CVE-2016-6325,264,None,#NAME?,10/13/16,1/4/18,7.2,None,Local,Low,Not required,Complete,Complete,Complete,"The Tomcat package on Red Hat Enterprise Linux (RHEL) 5 through 7, JBoss Web Server 3.0, and JBoss EWS 2 uses weak permissions for (1) /etc/sysconfig/tomcat and (2) /etc/tomcat/tomcat.conf, which allows local users to gain privileges by leveraging membership in the tomcat group."
27,CVE-2016-5425,264,None,#NAME?,10/13/16,9/2/17,7.2,Admin,Local,Low,Not required,Complete,Complete,Complete,"The Tomcat package on Red Hat Enterprise Linux (RHEL) 7, Fedora, CentOS, Oracle Linux, and possibly other Linux distributions uses weak permissions for /usr/lib/tmpfiles.d/tomcat.conf, which allows local users to gain root privileges by leveraging membership in the tomcat group."
28,CVE-2016-5388,284,None,None,7/18/16,8/15/18,5.1,None,Remote,High,Not required,Partial,Partial,Partial,"Apache Tomcat 7.x through 7.0.70 and 8.x through 8.5.4, when the CGI Servlet is enabled, follows RFC 3875 section 4.1.18 and therefore does not protect applications from the presence of untrusted client data in the HTTP_PROXY environment variable, which might allow remote attackers to redirect an application's outbound HTTP traffic to an arbitrary proxy server via a crafted Proxy header in an HTTP request, aka an ""httpoxy"" issue. NOTE: the vendor states ""A mitigation is planned for future releases of Tomcat, tracked as CVE-2016-5388""; in other words, this is not a CVE ID for a vulnerability."
29,CVE-2016-5018,254,None,Bypass,8/10/17,6/5/18,5,None,Remote,Low,Not required,None,Partial,None,"In Apache Tomcat 9.0.0.M1 to 9.0.0.M9, 8.5.0 to 8.5.4, 8.0.0.RC1 to 8.0.36, 7.0.0 to 7.0.70 and 6.0.0 to 6.0.45 a malicious web application was able to bypass a configured SecurityManager via a Tomcat utility method that was accessible to web applications."
30,CVE-2016-3092,20,None,DoS,7/4/16,7/18/18,7.8,None,Remote,Low,Not required,None,None,Complete,"The MultipartStream class in Apache Commons Fileupload before 1.3.2, as used in Apache Tomcat 7.x before 7.0.70, 8.x before 8.0.36, 8.5.x before 8.5.3, and 9.x before 9.0.0.M7 and other products, allows remote attackers to cause a denial of service (CPU consumption) via a long boundary string."
31,CVE-2016-1240,20,None,#NAME?,10/3/16,8/1/18,7.2,Admin,Local,Low,Not required,Complete,Complete,Complete,"The Tomcat init script in the tomcat7 package before 7.0.56-3+deb8u4 and tomcat8 package before 8.0.14-1+deb8u3 on Debian jessie and the tomcat6 and libtomcat6-java packages before 6.0.35-1ubuntu3.8 on Ubuntu 12.04 LTS, the tomcat7 and libtomcat7-java packages before 7.0.52-1ubuntu0.7 on Ubuntu 14.04 LTS, and tomcat8 and libtomcat8-java packages before 8.0.32-1ubuntu1.2 on Ubuntu 16.04 LTS allows local users with access to the tomcat account to gain root privileges via a symlink attack on the Catalina log file, as demonstrated by /var/log/tomcat7/catalina.out."
32,CVE-2016-0763,264,None,DoS Bypass,2/24/16,6/1/18,6.5,None,Remote,Low,Single system,Partial,Partial,Partial,"The setGlobalContext method in org/apache/naming/factory/ResourceLinkFactory.java in Apache Tomcat 7.x before 7.0.68, 8.x before 8.0.31, and 9.x before 9.0.0.M3 does not consider whether ResourceLinkFactory.setGlobalContext callers are authorized, which allows remote authenticated users to bypass intended SecurityManager restrictions and read or write to arbitrary application data, or cause a denial of service (application disruption), via a web application that sets a crafted global context."
33,CVE-2016-0762,264,None,None,8/10/17,6/5/18,4.3,None,Remote,Medium,Not required,Partial,None,None,"The Realm implementations in Apache Tomcat versions 9.0.0.M1 to 9.0.0.M9, 8.5.0 to 8.5.4, 8.0.0.RC1 to 8.0.36, 7.0.0 to 7.0.70 and 6.0.0 to 6.0.45 did not process the supplied password if the supplied user name did not exist. This made a timing attack possible to determine valid user names. Note that the default configuration includes the LockOutRealm which makes exploitation of this vulnerability harder."
34,CVE-2016-0714,264,None,Exec Code Bypass,2/24/16,7/18/18,6.5,None,Remote,Low,Single system,Partial,Partial,Partial,"The session-persistence implementation in Apache Tomcat 6.x before 6.0.45, 7.x before 7.0.68, 8.x before 8.0.31, and 9.x before 9.0.0.M2 mishandles session attributes, which allows remote authenticated users to bypass intended SecurityManager restrictions and execute arbitrary code in a privileged context via a web application that places a crafted object in a session."
35,CVE-2016-0706,200,None,Bypass +Info,2/24/16,7/18/18,4,None,Remote,Low,Single system,Partial,None,None,"Apache Tomcat 6.x before 6.0.45, 7.x before 7.0.68, 8.x before 8.0.31, and 9.x before 9.0.0.M2 does not place org.apache.catalina.manager.StatusManagerServlet on the org/apache/catalina/core/RestrictedServlets.properties list, which allows remote authenticated users to bypass intended SecurityManager restrictions and read arbitrary HTTP requests, and consequently discover session ID values, via a crafted web application."
36,CVE-2015-5351,352,None,Bypass CSRF,2/24/16,7/18/18,6.8,None,Remote,Medium,Not required,Partial,Partial,Partial,"The (1) Manager and (2) Host Manager applications in Apache Tomcat 7.x before 7.0.68, 8.x before 8.0.31, and 9.x before 9.0.0.M2 establish sessions and send CSRF tokens for arbitrary new requests, which allows remote attackers to bypass a CSRF protection mechanism by using a token."
37,CVE-2015-5346,None,None,None,2/24/16,7/18/18,6.8,None,Remote,Medium,Not required,Partial,Partial,Partial,"Session fixation vulnerability in Apache Tomcat 7.x before 7.0.66, 8.x before 8.0.30, and 9.x before 9.0.0.M2, when different session settings are used for deployments of multiple versions of the same web application, might allow remote attackers to hijack web sessions by leveraging use of a requestedSessionSSL field for an unintended request, related to CoyoteAdapter.java and Request.java."
38,CVE-2015-5345,22,None,Dir. Trav.,2/24/16,7/18/18,5,None,Remote,Low,Not required,Partial,None,None,"The Mapper component in Apache Tomcat 6.x before 6.0.45, 7.x before 7.0.68, 8.x before 8.0.30, and 9.x before 9.0.0.M2 processes redirects before considering security constraints and Filters, which allows remote attackers to determine the existence of a directory via a URL that lacks a trailing / (slash) character."
39,CVE-2015-5174,22,None,Dir. Trav. Bypass,2/24/16,7/18/18,4,None,Remote,Low,Single system,Partial,None,None,"Directory traversal vulnerability in RequestUtil.java in Apache Tomcat 6.x before 6.0.45, 7.x before 7.0.65, and 8.x before 8.0.27 allows remote authenticated users to bypass intended SecurityManager restrictions and list a parent directory via a /.. (slash dot dot) in a pathname used by a web application in a getResource, getResourceAsStream, or getResourcePaths call, as demonstrated by the $CATALINA_BASE/webapps directory."
40,CVE-2014-7810,284,None,Bypass,6/7/15,7/18/18,5,None,Remote,Low,Not required,None,Partial,None,"The Expression Language (EL) implementation in Apache Tomcat 6.x before 6.0.44, 7.x before 7.0.58, and 8.x before 8.0.16 does not properly consider the possibility of an accessible interface implemented by an inaccessible class, which allows attackers to bypass a SecurityManager protection mechanism via a web application that leverages use of incorrect privileges during EL evaluation."
41,CVE-2014-0230,399,None,DoS,6/7/15,7/18/18,7.8,None,Remote,Low,Not required,None,None,Complete,"Apache Tomcat 6.x before 6.0.44, 7.x before 7.0.55, and 8.x before 8.0.9 does not properly handle cases where an HTTP response occurs before finishing the reading of an entire request body, which allows remote attackers to cause a denial of service (thread consumption) via a series of aborted upload attempts."
42,CVE-2014-0227,19,None,DoS,2/15/15,11/8/17,6.4,None,Remote,Low,Not required,None,Partial,Partial,"java/org/apache/coyote/http11/filters/ChunkedInputFilter.java in Apache Tomcat 6.x before 6.0.42, 7.x before 7.0.55, and 8.x before 8.0.9 does not properly handle attempts to continue reading data after an error has occurred, which allows remote attackers to conduct HTTP request smuggling attacks or cause a denial of service (resource consumption) by streaming data with malformed chunked transfer coding."
43,CVE-2014-0119,264,None,None,5/31/14,11/8/17,4.3,None,Remote,Medium,Not required,Partial,None,None,"Apache Tomcat before 6.0.40, 7.x before 7.0.54, and 8.x before 8.0.6 does not properly constrain the class loader that accesses the XML parser used with an XSLT stylesheet, which allows remote attackers to (1) read arbitrary files via a crafted web application that provides an XML external entity declaration in conjunction with an entity reference, related to an XML External Entity (XXE) issue, or (2) read files associated with different web applications on a single Tomcat instance via a crafted web application."
44,CVE-2014-0099,189,None,Overflow,5/31/14,11/14/17,4.3,None,Remote,Medium,Not required,None,Partial,None,"Integer overflow in java/org/apache/tomcat/util/buf/Ascii.java in Apache Tomcat before 6.0.40, 7.x before 7.0.53, and 8.x before 8.0.4, when operated behind a reverse proxy, allows remote attackers to conduct HTTP request smuggling attacks via a crafted Content-Length HTTP header."
45,CVE-2014-0096,264,None,Bypass,5/31/14,11/14/17,4.3,None,Remote,Medium,Not required,Partial,None,None,"java/org/apache/catalina/servlets/DefaultServlet.java in the default servlet in Apache Tomcat before 6.0.40, 7.x before 7.0.53, and 8.x before 8.0.4 does not properly restrict XSLT stylesheets, which allows remote attackers to bypass security-manager restrictions and read arbitrary files via a crafted web application that provides an XML external entity declaration in conjunction with an entity reference, related to an XML External Entity (XXE) issue."
46,CVE-2014-0095,20,None,DoS,5/31/14,11/14/17,5,None,Remote,Low,Not required,None,None,Partial,"java/org/apache/coyote/ajp/AbstractAjpProcessor.java in Apache Tomcat 8.x before 8.0.4 allows remote attackers to cause a denial of service (thread consumption) by using a ""Content-Length: 0"" AJP request to trigger a hang in request processing."
47,CVE-2014-0075,189,None,DoS Overflow,5/31/14,11/14/17,5,None,Remote,Low,Not required,None,None,Partial,"Integer overflow in the parseChunkHeader function in java/org/apache/coyote/http11/filters/ChunkedInputFilter.java in Apache Tomcat before 6.0.40, 7.x before 7.0.53, and 8.x before 8.0.4 allows remote attackers to cause a denial of service (resource consumption) via a malformed chunk size in chunked transfer coding of a request during the streaming of data."
48,CVE-2014-0050,264,None,DoS Bypass,4/1/14,12/15/17,7.5,None,Remote,Low,Not required,Partial,Partial,Partial,"MultipartStream.java in Apache Commons FileUpload before 1.3.1, as used in Apache Tomcat, JBoss Web, and other products, allows remote attackers to cause a denial of service (infinite loop and CPU consumption) via a crafted Content-Type header that bypasses a loop's intended exit conditions."
